{
  "schema_version": "governed_path_cost_input_v0",
  "scenario_id": "GOVERNED_PATH_COST_001",
  "scenario_class": "proof_sensitive_governed_path",
  "task_class": "bounded_router_trigger_fix",
  "path_id": "full_governed_path_unprepared",
  "operator_minutes": 17,
  "intervention_count": 2,
  "repair_cycles": 1,
  "closure_latency_minutes": 21,
  "first_bundle_status": "PARTIAL",
  "first_pass_closure_ready": false,
  "final_closure_status": "ACCEPTED",
  "false_green_exposure": 0,
  "artifact_completeness_percent": 100,
  "notes": "Without predeclared proof planning, one proof section was discovered late and repaired before accepted closure."
}
